{
  "$schema": "https://json-schema.org/draft/2020-12/schema",
  "title": "data/site.json: la web",
  "description": "data/site.json: lo general de la web y qué proyectos salen, en qué orden. VS Code lee este fichero (por el \"$schema\" de arriba del JSON) para autocompletar, explicar cada campo y subrayar lo que está mal; el build y la vista previa lo usan para revisar.",
  "type": "object",
  "required": [
    "title",
    "background",
    "lists"
  ],
  "additionalProperties": false,
  "properties": {
    "$schema": {
      "type": "string"
    },
    "_": {
      "type": "string"
    },
    "url": {
      "type": "string",
      "pattern": "^https://",
      "description": "El dominio, sin barra al final: \"https://mirandaperezhita.com\". Con él, Google indexa la web."
    },
    "title": {
      "type": "string",
      "description": "El nombre de la web: en la pestaña y en Google."
    },
    "background": {
      "type": "object",
      "additionalProperties": false,
      "required": [
        "ca"
      ],
      "description": "El color de la columna de la izquierda, en cada idioma.",
      "properties": {
        "ca": {
          "type": "string",
          "pattern": "^#([0-9a-fA-F]{3}|[0-9a-fA-F]{6})$",
          "description": "Con la web en catalán: \"#F9F8F6\""
        },
        "es": {
          "type": "string",
          "pattern": "^#([0-9a-fA-F]{3}|[0-9a-fA-F]{6})$",
          "description": "Con la web en castellano."
        }
      }
    },
    "threshold": {
      "type": "number",
      "minimum": 0,
      "maximum": 100,
      "description": "Del 0 al 100: a partir de qué claridad el color de un proyecto se considera claro y su texto va más oscuro. Con 0, todos."
    },
    "lists": {
      "type": "object",
      "additionalProperties": false,
      "required": [
        "projects"
      ],
      "properties": {
        "projects": {
          "type": "array",
          "description": "Los proyectos, en el orden en que salen. Cada uno, el nombre de su carpeta de projects/ y su color.",
          "items": {
            "type": "object",
            "additionalProperties": false,
            "required": [
              "project",
              "color"
            ],
            "properties": {
              "project": {
                "type": "string",
                "pattern": "^[a-z0-9-]+$",
                "description": "El nombre de su carpeta en projects/: \"carnaval\""
              },
              "color": {
                "type": "string",
                "pattern": "^#([0-9a-fA-F]{3}|[0-9a-fA-F]{6})$",
                "description": "El color de fondo del proyecto: \"#BB6464\""
              },
              "visible": {
                "type": "boolean",
                "description": "false: no sale (ni en la web ni en Google). Sin este campo, sale."
              }
            }
          }
        }
      }
    }
  }
}
